text,class_label
film work lot different level  profile one cool couple  social commentary age nursing home  love story  musical  see uncle frank time  every time watch sure go call first  parent  wife  friend lose touch   way make remember important relationship life  want reaffirm one continue  expect lot laugh  probably tear vibrant character strike chord  pretty sure,positive
it matter whether experienced plight elderly america plain clueless  uncle frank matter give clue straight forward  funny  wake smell rise sort way  end film  obvious totally entertain  somehow  also educate  terrific film  terrific come talent movie field  matter name pay attention,positive
silver screen  get freshly polish beautiful film age happily enjoy life rainbow  plenty silver hair silver screen  film namesake like go energy  humor lust life  story entertainer extraordinaire uncle frank  devote wife aunt willie  zippy resident local area nursing home inspire u  live day last  brings glimmer hope golden year  great movie young old audience,positive
anatomy litas direct film   journey   star yum banner  menorah err  robot motley  beg  marshall  anna jacks  mason towards  be    be   film take place vulgarian uprising concern group traveler problem get political problem part world  put bus sienna  ruffians  lead major sure  banner  confiscate passport hold question  one passenger pal flaming  towards   pose america reality vulgarian freedom fighter  major believe smuggle hungary  fact  lady ashore  err  hide  become focus major romantic attention  be    be   good film conveys tension hassle cold war  performances wonderful  banner particularly excellent passionate major it bad  anna jacks give realistic  powerful performance pregnant woman it want child bear communist country  be    be   good script  good director  good cast  film like  highly recommend,positive
many excellent comment movie want add voice praise  yum banner never powerfully attractive  major sure rivet  eye leave screen  movie  slight rest cast also exemplary  especially menorah err anna jacks  mostly stage actor  bring many nuance performance  example  see movie little time  first time notice reaction german girl come russia soldier  even though threaten  absolutely hysterical reaction make realize must germany wait likely gangrene red army  possibility discover deep layer story may lie beneath surface make want see fascinate film  please put do,positive
people consider yum banner great performance ruler slam king  certainly give wide variety mood test ability  comic  tragic  eager learn dominate hateful  also show advantage  talk singer  dancer  finally  also tony award win performance roadway  film allow u capture something great roadway performance well  be    be   movie show talent well king  comic turn feel quite nice  performance general bunion  raise ten commandment  yet come terribly close successor epic on  man love hate   certain vulnerability act role endear movie public  even good year star behind  retreat repeat king slam television stage  be    be    fine performance drama menorah err  mason towards or  robot motley  e g marshall  anna jacks  bonnie toward  film set pretty modern time  powder hungary  briefly look like iron curtain collapse reform vulgarian patriot mire navy supporter  vulgarian revolution collapse due bad timing  ruffians polish east german ally send tank crush revolt  arrest execute navy reformer   west stood let happen  inland france get catch sue crisis  u berate israel attack egypt  due action three close ally u  west find hard condemn overkill soviet union  unfortunate situation  vulgarians never forget abandon  be    be   film banner major sure  russia intelligence officer watch leader vulgarian revolt  one pal cede  mason towards   cedes may get assistance westerner bus tour hungary  lead robot motley  include marshall  jacks  toward  err   latter keep hotel bus repair  banner mingles  hop lead whereabouts towards  banner human  try ingratiate people  see monster   sequence  drink little much  confronts question bother historian since   even one note russia stain charge  relation russia west collapse quickly  ally  whole  work well together  malta type mutual suspicion erupt   sure good officer  tear half loyalty communist regime soviet union hungary support  grow fondness towards err  hiding towards also willing note human side russia major  film reach tragic climax  watch sure decide follow sense duty  take pity err  towards  westerner want leave  becomes true struggle  one may win far late  great film tragedy post war rope  possibly thoughtful role yum banner ever portray,positive
yum banner symbol villein tine   play role russia leader hungary time revolution country make maxim  be    be   script film make good taste writer mix love adventure show different character journey hungary inland  be    be   good point film symbol challenge vulgarian resistance kill russia major  yum banner  hall time film make meaning disadvantage major bad work  end make good work help menorah err escape darling onion write book good work gain end people  agreement treatment assassination vulgarian resistance,positive
journey  good film  produce spring  sienna  release  movie quite popular early year  despite political problem  influence movie success  story happen vulgarian revolution  cold war    journey  good film   think release immediately do  people see far want home  one important quality film extraordinary chemistry menorah err yum banner  intense relationship  scenes together important  also reveal strong feeling  great passion love character  major sure liana ashore   another quality script  well write  even publish novel  screen player gorge tabor  film keep tension begin end  first  it know liana traveler could leave hungary  communist major discovers liana friend  pal cedes  vulgarian it allow leave country  major fall deeply love liana  fact  true reason it want let go  embrace give one memorable kiss ever see screen  kiss   let go  end film one dramatic end ever major liana say  goodbye    arrive frontier traveler  include pal  sure shoot several time vulgarian  my  yum banner  handsome menorah err beautiful  charm  refine  like english lady  yum menorah perfect together  one great couple golden  true moviegoer watch film   journey  everything good film have great  captivate story  interest character  wonderful direction  anatomy litas  opinion  good   finally  want give message warn pros studio restore release classic film  please  release  journey  do soon possible,positive
big fan  always disappoint halfhearted attempt get russia romantic aesthetic  case point  yum banner  think whole problem poor cast decision  see yum major sure change mind  give intelligent script work  suddenly come alive noble   conflict could ever want neurotic russia officer  well major sure  writer tabor actually give yum  conflict russia officer  kind conflict russia officer line worthy real literature  real meaning pathos  example  propose folk music  say musingly   hear man cry dark  listen carefully enough  know cry  look surprised  lady ashore  despite may hear  tractor maxim it thing russia care  always time music    be    be   brilliant,positive
great movie  rather unclear political message  shot theatrical style    action take place inside  mayor sure liana seem equally suspicious  emotion run high since western tourist seem unwilling unable yield charm mayor  although make every effort understand point view  two opposite worldviews make pointedly clear  movie also show human emotion control politics  powerfully act high emotional impact movie,positive
really enjoy movie  first time turner classic movie  actor well banner steal show like always    one movie see banner emotion  actually movie first ever see laugh play strong  serious role movie  movie see masculine  tough sensitive side banner banner seem   amaze banner eats glass cup speaks russia tongue drive crazy love  it understand banner err  good chemistry  star movie together banner always die end kind remind  king  way,positive
yum banner major sure  sing  dance  russia officer station near austria vulgarian border vulgarian uprise anatomy litas journey  though film yet release video do  remain one banner compel performance  political unrest  group traveler fly put bus sienna  reach border  however  passport take detained question russia lead major sure  be    be   major reason suspect vulgarian freedom fighter among group smuggle country  indeed lady ashore hide mysterious passenger  pal flame  mason towards  or  pretend america fool one  help flame mainly repay debt owe trouble past association cause  among passenger brutish journalist play robot motley  america family play beg  marshall  wife anna jacks two child  one screen debut little on toward  be    be   major sure take romantic interest lady liana ashore  menorah err   romance sort develop  offer nothing disdain stiff upper lip  however  though suspect underneath heart still beat  cold war intrigue powerful act carry story romance never quite convince  remain  however  one favorite yum banner film deserve see passionate performance,positive
see several yum banner film  yet good performance camera capture emotion close snarl  smile  laugh  banner might equally arrest ten commandment  tar bulb  magnificent seven  brother mad woman challot none film capture range talent close ups one  arrest tantalize watch every shot  be    be   equally fascinate  without remove clothes  menorah err  script allow exude sensuality visual suggestive  reprise sort role year later night iguana  film suggest sleep anyone help release group clutch ruffians fact show run away russia major  contrast story be denizen story   yet film burst suggest real physical allure err character  be    be   err never classify beautiful actress view  superb actress  put soul dignify character portray  often clash spirit character  contradiction make role journey  duo wadis  night iguana memorable  be    be   unusual film  easy see russia character portray good people  do exception  banner romance horse thief great cinema graham kolinsky never acknowledge intolerance towards leftists era  be    be   film also unusual casting  great french actor hear our about aim  rub shoulder mason towards or brutish actor robot motley  many way film international america  four great actor add entertainment  be    be   read denizen work find film true either work  yet film stand sanitize  censor   version dignify charm  provide reality night lead release group  think litas deserves last laugh provide interest plausible twist tale lead make film  entwine bit write tale  beg  last bus ride final kiss   be    be   one grouse  never acknowledge source inspire story  recently  beg  insomnia  original work begin mention prominently credit,positive
set vulgarian revolution  story suspense good cold war book movie multinational group foreigner attempt smuggle mason towards hungary austria  however  three thing complement story  make extremely good movie  be    be   first  actor use actual language role  russia soldier speak russia  vulgarian vulgarian  german german  except minimal extent tell story  since zebra err english  speak english   course  yum banner others essential story also speak heavily accent english  result  empathy audience traveler become paramount  viewer share confusion suspense involve illicit border cross she understand languages speak around  powerful feeling arouse audience  notwithstanding heavy use foreign language  audience never loss follow film  subtitle necessary  be    be   second  hungary  tell  movie right  gypsy music overpower dinner meal underground cavern building much action take place village scene  realism incredible  it eat actual restaurant movie  eat double  think actually walk main street village   actually  film shot austria    be    be   third  important  movie reunite err yum banner  king  magnetism story unfolds nothing short scar qualify  course  yum already receive scar play relationship  academy it go give another one  quality film  it miss one,positive
journey  romantic version cold war  english woman  menorah err  try smuggle former love  vulgarian scientist  mason towards  or   hungary hungary revolt  board bus thirteen international people try get hungary austria border  be    be   course  bus get stop russia security check  russia  yum banner  become attracted english woman  menorah err  delay trip  course  russia officer know truth vulgarian scientist pose brutish citizen  decide arrest scientist wait english woman come  course  sound absurd  fun movie watch  despite romantic flow dialogue my banner m err  seem inappropriate situation  movie become suspenseful interesting  good act override silly dialogue  perhaps  people involve vulgarian revolt would appreciate movie  would consider piece fluff   be    be   favorite yum banner role  speak  masculine voice attractive  especially become vulnerable  menorah err second time work yum banner since make  king   make attractive couple  bad never work  second role m err take since  eternity   despite fact m err wear heavy winter clothes throughout movie  beautiful sensual   be    be   fine support cast head mason towards  or  first film role  international cast recognizable  like instance  robot motley inland  however  rest actor  never see since  great movie  background  fun see sent burger  one maid  speak line vulgarian  year later  movie   cast giant shadow   yum banner lead lady  still work today,positive
set hungary nonmember  story group foreign national try leave country time uprise  be    be   airport close  titular journey begin bus take austria  would obvious  stop way come almost faultless yum banner whose military power red army major mark loneliness  internal struggle right wrong  search truth need feel emotion human be  sadden fact job alienate friend enemy alike yearn social contact  be    be   robot motley play quintessential stiff  matter serious role  manage maintain almost lighthearted logical outlook life mason towards stun movie debut enforce reason many role throughout career  menorah err  lead lady  exhibit grace femininity come associate yet manage bring strength resolve require character  be    be   film deal tempestuous time history never cease remind u good u never completely judge book cover  fabulous scriptwriting ensures seriousness subject still great loneliness comedic instance add  rather detract movie  chemistry cat mouse game err banner make understand appear one film together  be    be    thoroughly engross movie would definitely watch,positive
literate  intelligent drama group international traveler hold virtual prisoner hungary invade russia communist regime  err towards play lover  brutish baroness  vulgarian freedom fighter try bit country  new york theater star period anna jacks  e g marshall play america couple travel two young son  include sonny toward screen debut  jacks character hugely pregnant anxious give birth communist country  give impassioned plea third act film presage naturalistic act style come know today engrave  fond   street  lead pack soviet wolf yum banner  magnificent commandant best since play opposite err  king   mean nasty terribly conflict attraction lovely  patrician   heroic err  one great transition film latter part golden era america film  miss,positive
good show  really good act  director take u swim storyline interest  unpredictable way  especially since  essentially  two people room  it race like many modern film  it drag  either  bowl flippant enough believe   character  still involve go back career  choice  believable without need show u deep  soul  bandage delicate balance weight  innocence  meekness  class pull buddy  well  bit grainy film quality  fit tone story  could use little polish hair makeup end thing  definitely worth watch,positive
see film sidewalk film festival  a  actually really fun festival  blow away  good movie see day long shot  school age prostitute meet middle age man attempt end deep depression together  inner look dark part human quality  story stem real life occurrence  rip straight headline  raw  blunt dialog killer twist end  film contain graphic pal dialog nudity  definitely suitable kid  depress people taste  definitely worth check opinion though,positive
although dark  depress  time hard watch  alone hold attention refreshingly honest dialog  truly capture angst teenage romantic relationship  addition  soundtrack amaze  lyric tone song complement sadness film well make wonder track create specifically movie   be    be   vesica bowl good actress ever watch  compel believable performance make movie  make wonder really prostitute  know  anyway  movie worth see  love  sister  yeah  right,positive
one good movie see long time  becharm way look thing completely unique movie disappoint  be    be   movie guess throughout  seemingly taboo topic address keep glue screen  bad guy good guy  becharm make sure  character perfectly complex feel  care  be    be   becharm use attention detail unmatched world  fast food movie  topic may make uncomfortable  love feel give  be    be   heard say often new story tell  thank german becharm prove false  be    be   run  it walk  see movie,positive
really movie need see twice  first see film really draw story  majority story take place inside hotel room  story buddy  nick drake  wonderful allusion  daphne share take outside room world  conversation get feel loneliness pain feel  soundtrack accompanies movie perfectly  dark  loft intrigue  see film second time around pick clue miss first time around lead one good end see long time  hope see movie find distributor do accessible  great movie  wo it disappoint,positive
actually consider invest movie german drum funding  love script like end  german insist end  be    be   see complete movie say amaze  read script imagine act  german direct  would powerful move  two lead amaze job  believable movie well worth watch performance two amazing star  be    be    spoiler see movie please it read need see movie first   actually wish never read script could experience movie end first hand    be    be                  spoiler  be    be   two main problem movie  first  sure mention read script  wife die  dead end would much believable   guy agonize woman leave year ago   leave still love long seriously delusional  it come across way script   also problem expend energy go wife still love    be    be   plus  wife dead would actually able believe fulfil  reciprocate love  therefore believe guy devastate enough end reasonable  be    be   however  it buy daphne end  need heck lot convince believe naive girl  naive whore believable due bowl performance   character simply cold enough  kind love  something else  whole piece miss  be    be   much movie reminiscent   lie  video tape   think could popular german choose give movie believable end   be    be   watch movie  enjoy performance  make mind,positive
see film brooklet international film festival  world premiere    be    be   haunt  intimate portrait loneliness  repercussion let grow turn something darker  be    be   act two lead  vesica bowl  richer bandage  excellent  make one wish meet character become damage  be    be   remind theme work atom gowan  exotica  almond carver  call    be    be   soundtrack  wan na jo basket  crook finger  excellent reinforces moment film without draw attention  be    be   highly recommend film soundtrack,positive
movie like happiness meet lose translation sixth sense end  maybe cry game surprise   good soundtrack probably ever hear  make sense  be    be   first second pretty much tell twist ride   surprise one walk right away brooklet premiere    film settle talkfest two really damaged people  daphne buddy  be    be   lonely  mess  boy talk  daphne bring life interesting tale escort  quite funny  my change  disturb  garland scene music tell u see might go  daphne really feel   friend use escort  might add  seem quite real   be    be   alone multilayered mostly brilliant  okay  maybe couple minute little talk  it know miss anything   be    be    need see know end  be    be   like movie  be    be    director ask people brooklet audience write review mob lot people read  request grant,positive
film engage complex maintain simple beauty two character come together share base curiosity loneliness  springboard learn people  life style pasts support  be    be   two lead actor  bowl   moment two actor ever see   believable  transport audience seemingly effortlessly  world  actor  seamless act team becharm beautiful  realistic dialog truthful direction drive story forward strike move film visual treat soft  increase intensity story  soundtrack serenade viewer  soothe yet draw emotional content film  find project nothing short masterpiece,positive
fantastic movie two people  one young teenage girl   middle age man  look someone help fulfill certain emptiness leave former love one  be    be   actor give brilliant performance various audience relate  script  although write german becharm  seem though write woman point view  time  man relate male character well develop describe movie  be    be   end movie unusual powerful unexpected twist leave speechless  would recommend film anyone ever felt lonely abandon love one  clear film alone,positive
film director nightmare  especially mega buck  multiplex variety  student art still high threshold disbelief suspension buying film maker vision  find  gem alone  exhilarate find  intimacy pace draw never let go  vesica bowl richer bandage give thoughtful nuanced performance director german becharm display deft hand present understandably disturb day live two terribly damage people  be    be   spoiler  be    be   buy do version share several people  reaction vary  disbelief ability daphne complete assignment buddy pay inability watch whole film real emotionally devastate  compulsively skeptical moviegoer either grab collar haul ride sidle seduce filmmaker  film take later route end involve felt daphne horror pain role buddy demise  reaction film remind watch cook  thief  wife lover  peter many  many year ago  end fascinate repel utterly unable tear eye away film  watch film several time truly appreciate eye ear director demonstrate  familiar work do include couple cheeky movie  galactic gigolo  attack killer bimbo  mix bag kiss  recently learn kill cradle producer it really represent director vision  bad  love prior two film even find kiss  interest wish kiss  available director cut original vision music tact  look forward future work interest director lead vesica bowl richer bandage,positive
alone beautiful  almost delicate film  smart direct  crisply write  two complex rivet performance  twist end one see come  make want see film second time go back catch clue misread  be    be   story  girl drowns depression awkwardness work hour week  hour  schoolgirl  escort  depress nextdoor neighbor discovers secret hire afternoon call downtown new hotel  feature breathtaking performance vesica bowl  girl  richer bandage  neighbor  be    be   bowl daphne give breakthrough performance par baggie secretary  capture teenager angst grow skin  talk always control  start realize control  danger go deep end  guess way  be    be   bandage buddy depress  angry  heartbroken  shell man  it film startle conclusion grasp full comprehension pain  be    be   brief open segment  hook independent film lover  religious right run towards exit  bring hotel room  first sure people  filmmaking style  shaky  annoy  like character  realize back story  tell short flashback  confrontational first reason  camera  open  story settle  likewise  camera   it know  minute  give take  find unable take eye away screen  be    be   see world premiere screen brooklet film fest  director ask audience anyone expect end one person answer yes  almost wish film already video could watch  think back conversation film  particularly candid dialog regard fantasy climax  really think thing go different direction  realize much conversation mean something completely different imagine  need see    dark pal much talk  blunt say little  find laugh might expect candor  definitely fall  thing think  lack nerve say loud  category  blunt  especially realize much completely different mean  make uncomfortable  especially watch alone partner  definitely something talk  perhaps argue  afterwards  perhaps come warn  alone watch  music amazing  would come home  purchase soundtrack favorite online music store could  film look good anything shot film  screen director german becharm ask sort process use get digital footage look good  answer  none  could it afford  be    be   give becharm credit  big fan two short  pretty girl object mirror  even could prepare complexity surprise film  be    be   everyone involve  bravo,positive
