text,class_label
first adventure him person beloved puppet character competent musical comedy vehicle permit frog leave carefree  swampy surroundings bright light  egg strand agent do despise overheard sing   way  meet nozzle bear  pitiful standup comedian names coburg el sleazy café telly savage bouncer model khan patron    dog roll  bestial drummer animal tailback  funky band  egomaniacal beauty queen miss piggy  ceremony preside would edger be   et   permit et a pursue frogmen burger magnate charges during reluctant acolyte bust  sell car  ice cream balloon  respectively  melton belle  bob hope richer prior  serve food insolent waiter stave martin  nearly brainwash mad german scientist mel brook  finally  land audition office movie mogul arson well  loris coachman secretary   pleasant song score come courtesy pal willies also make appearance resident pianist el sleazy  record  recently acquire four subsequent puppet movie watch week come turn fall due,positive
see begin puppet movie  half  watch mars kelly friend house  song good puppets hilarious  learn believe end rainbow  anyone make  matter small  matter green  include trailer    be    be   permit favorite protagonist  mean describes main character  puppets  mel brook amaze play professor man cragsman  scene miss piggy save permit king fun guy  cool  be    be   puppet movie good him person film hilarious character people cherish successful film,positive
go see movie last night coax friend mine  admit reluctant see knew fashion butcher able comedy  wrong  butcher play character take fisher well  kelvin corner play ben sandals professionalism  sign good movie toy emotion  one exactly  entire theater  sell  overcome laughter first half movie  move tear second half  exit theater see many woman tear  many full grow man well  try desperately let anyone see cry  movie great  suggest go see judge,positive
boyfriend go watch guardian first it want watch  love movie definitely good movie see portray us well  really show think really appreciate moment teach really good movie  movie show really hard job be think us would challenge scary  great movie around  would suggest movie anyone seethe end break heart know  storyline great give thumb  cry emotional  would give could,positive
ask movie throughout film  would tell great  however  leave theatre feel unsatisfied  think little  believe problem pace end  feel majority movie move kind slow  end develop fast   would say end leave disappoint  be    be   think character well develop  corner butcher portrayed role well  yes  fashion butcher act  also  different relationship character seem real  furthermore  think different plot line well develop  overall  good movie would recommend see  be    be   conclusion  good character  great plot  poorly end  still  go see,positive
look forward guardian  walk theater it really mood particular time  kind like olive garden  like  right mindset thoroughly enjoy  be    be   exactly sure dampen spirit  trailer look good  water theme give bad flashback last kelvin corner movie dealt subject  waterworks  plus  despite promise fashion butcher show butterfly effect  still completely sell  something guy annoy  probably simian feature  be    be   take approximately two minute fear subside hesitancy slip away  movie immediately throw u midst tense rescue mission  grip tight penny rogers  orange face lift  concern briefly bristle butcher initial appearance due fact much effort make paint ridiculously cool rebellious  sunglass  tough guy toothpick mouth  sport  smirk make gorge looney proud  yeah  get  totally ready hate  be    be   go deliver fairly strong performance force soften jab   be    be   darn  ape man  efficiently mix tense  excite rescue scene  drama  humor  solid act  guardian easily film dare say majority audience enjoy  quibble clichés  predictability  rare moment overcook sappiness  none take away entertainment value  be    be   bad feeling pace would slow much corner start train young guy  contrary  training session might interest aspect film  coast guard rescue swimmer hero whose story never really portrayed big screen  feel inside look go tough make informative great way introduce audience group  be    be   take rescue swimmer  think get go dangerous mission cold  dark  rough water  must fight disorientation  exhaustion  hypothermia  lack oxygen try help strand  panic people depend survival  it bad enough  sometimes a it save everybody make tough decision live my  be    be   man  want responsibility   idea really like guy  would think fashion corner movie thank education   be    be   guardian great job pay tribute rare breed hero  lucky u also good job entertain pay customer  be    be   gist  be    be   moviegoer want inside look like embark dare rescue mission middle ocean might want give guardian chance  see free  pay would felt get money worth,positive
pleasantly surprised find movie show sneak preview local theater  be    be   see plot line  top gun   jane  officer gentleman  good script still work  story basically train coast guard rescue team couple side story line  kelvin corner play highly successful rescue team leader  ben sandals  force head training team tough mission  movie take u rigor train process personal story corner character take fisher  play fashion butcher  happy say fashion great part  be    be   great surprise movie probably realize come long arrives  however  use humor  exploration toughness training fun watch ben sandals  thing trainer   keep rivet thoroughly entertain  really enjoy watch movie make entire audience laugh loud  gasp  clap end tribute movie  be    be   good time  despite couple tough moment movie   think,positive
work movie theater every night employee screen one movie come next day  today guardian  see trailer ad never expect much  way really anticipate see movie  well turn movie lot would think  great story first  fashion butcher kelvin corner amaze act work film  big fan show always find hard think butcher anyone kelson despite great act butterfly effect  see movie think might able finally look serious actor  be    be   also great tribute unsung hero u coast guard,positive
attend advance screen film sure expect kelvin corner fashion butcher  deliver little memorable performance  film  underlie  general  storyline somewhat familiar  film excellent  corner butcher deliver powerful performance play extremely well  human frailty strengths respective character incredibly play  scene corner confront butcher personal reason butcher join coast guard rescue elite film unforgettable emotional moment   specific  storyline education depict personal sacrifice demand physical training elite coast guard rescuer must go preparation job  responsibility  save life sea  special effect rescue scene extremely realistic  wow   it see angry sea since  perfect storm   costar chancy brown  ho  carnival   great see  play captain coast guard zodiac  plasma base strong  convince role leader prerequisite necessary ice water vein  film wonderfully  finally  give long overdue exposure respect coast guard  audience applaud end,positive
others comment around web  pilot coast guard  say  skeptic  go expect cheese factor  cheese   much  film pretty accurate  be    be   watch trailer today  see film yesterday  realize trailer give impression movie nothing rescue rescue action scene  it case  be    be   movie truly driven action  inner struggle corner butcher deal  butcher reveal movie corner  be    be   course  minor love story  surprise  part  movie tell tale two life come together  time  help heal old wound  be    be   girlie sound  corner  much try like  butcher actually work quite well together compliment well movie  be    be   critic state  see  top gun  officer gentleman  et  movie it remake million time  be    be   recall one f word speak  a it really recall language  be    be   movie  hour   may tend get little long towards end  be    be   laugh  may cry  honestly say  worth  pay  be    be   hope enjoy movie,positive
go advance screen movie think embark minute cheeky line  mindless plot  kind nauseous act make  postman  one malignant display cinematic blundering time  shock  shock find film star corner appeal soul audience  shock fashion butcher could act serious role  shock film star actually engage captured emotion  since robin hood  see corner  full depth complex emotion  butcher seem tweak serious act play  butterfly effect   two actor come film serious  focus attitude shone think one good film see year   scar worthy movie  epic  profound social commentary film  rather  story simple topic  illuminate way brings audience high level empathy think possible  think good filmmaking one thoroughly impressed work  bravo,positive
brilliant move performance tom courtesy peter finch,positive
dresser  perhaps refine backstage film  film brim wit spirit  part provide  energetic  character normal  tom courtesy   although character clearly gay  certainly attraction lead performer  alert fin  assist  film never dwell make  be    be   gritty style peter hat work well  bullet  display  give film sense realism coherence  much appreciate story could easily become tedious  end   dresser  bore many people silly  truly delight love brutish cinema  be    be,positive
one three anytime favorite movie  quibble director  peter hates  many cut show actor individually instead together scene  performance great forgive  be    be   alert fin tom courtesy absolutely marvelous  brilliant  script great  give good picture life theatre world war    therefore  like well   lot great  subtle touch  lot broad  overplay stroke  perfectly do  scene scene blow away  heartbreaking climax,positive
yardstick measure movie get squirmy  start shift position notice butt sore  film long  movie even come close boring  predictable part sure  never bore  be    be   military branch love note write see recruitment level go  coast guard  definitely  day boat sink  be    be   movie enjoyable fun  kelvin corner perfect age macho man it know quit  however  impressed fashion butcher performance  never like  never watch to show always consider immature  well  punk  film  great job  well way status  think film show must advance rough cut something   way  film stock turn grainy  sound level drop microphone see drop place  also view representative movie  look audience feedback  particularly part film it like  be    be        possible spoiler  feedback give concerned couple line begin  kelvin corner come home see wife  sell ward  pack stuff move  say   maybe one move   reply    it know anything house  one go   it make sense  know layout well  corner right    one leave,positive
many comment film say  like add show last week around community cinema  get overall average score   recommend   today audience  especially see real cinema screen  talk others afterwards  audience  be    be   sheer power act performance whole troupe incredible quite spellbind  course  fin courtesy truly star  everybody thoroughly well cast  afternoon audience  majority  senior citizen   fact plot could follow ease clarity speech wonderful use camera sound great influence  be    be   delightful  many say  see really great film brutish  still date twenty year  full fill blood  gut  confuse camera shot  back forth time story line  seedy scene  view even utter young,positive
dresser  small absolutely wonderful film  brilliantly act alert fin tom courtesy  world tiny film attract enough attention garner five major academy award nomination back mystery  nice know academy guilty display good taste every  course  give award year  term endearment    it want accuse show much taste    be    be   alert fin drunken actor production  king hear   tom courtesy man work double time behind scene keep actor front footlights  hilarious piteous see courtesy character shower fin attention affection  see effort utterly unappreciated dismiss  even bitter end  fin courtesy work wonder together  though fin get showy moment  get recite   courtesy heart soul film  be    be   grade,positive
worth mention omit review read  subtext law shape live behavior gay era portray film  courtesy character evidently gay  one  often talk my  reason never see  reason allude disappear seem detain police hormonal activity  criminal offense inland time  be    be   read surface recent event unsettle normal  courtesy character  also see pass remark openly  toward fox character  quick renunciation connection person law involve  fear association affect many character  part portrait film paint time people inhabit  abandonment courtesy end sir anticipated way  subtext include  also make sense otherwise inexplicable omission dresser list give thanks  flamboyance combine fear exposure produce combination yearn fear courtesy step footlights   make announcement imminent air raid  scene would otherwise gratuitous  symbolic literal depiction man inner torment  be    be   drama decline fin sir  great deal tragedy film play come fatal flaw  courtesy gayness  make film  title suggest  be    be   art direction  pace cinematic style film seem come another time  distant eighty  way  even second world war  implicit portrait society still cling old moral order  sympathy character rack ruin cruelty order  necessity trap enclose world theatre  knowledge much would sweep away war make film poignant  flaw,positive
anyone appreciate fine act ring dialogue love  be    be   film  take road take side  hardwood  funny  be    be   ultimately excoriate analysis relationship two  be    be   factory  type  alert fin sublime despotic  be    be   actor barely notices world war rag  be    be   around  intent crumble fortune theatre  be    be   company psychological emotional breakdown  be    be   tom courtesy matchless normal  dresser  title   be    be   whose apparent devotion turn anything selfless  be    be   really must see,positive
sir  play hear time  tonight a it remember open mirror  eye reflect king madness  dresser prompt gently  mouth air desperation months great actor know power slip away  valet cut major dome cut conscience cut surrogate wife  aware boy decline madness know powerless ease pass   dresser  really love story trooper year become mutually dependent one another extent neither conceive future without  set second world war  concern fortune frankly second  rate tour company comprise equal number  be wannabe lead  sir   theatrical knight might kindly call  old school  whatever part play grab center  stage bellow footlights  bully audience  somewhere inside  bury time deep beneath ham regularly dish  still remain occasional glitter earlier greatness catch glimpse audience fervently hope  my finned cleverly concentrate ham  often point caricature   ready dismiss performance mere hyperbole bluster produce moment exquisite subtlety vulnerability make realize great actor play great actor  go my easy write portrayal  be    be   normal exercise middle  age effeminate rather camp theatrical dresser sashay way life  enjoy company  girl  love wicked insider gossip rife  theatre   strongly suspect still  many man like normal kind patient  know play many actor  run backstage wisdom affection believe vast majority would hoot approve laughter my courtesy portrait  see  dresser  onion stage  perceive wisdom  my courtesy  normal  rather subdue movie   sir  play great my freebie ones huge acclaim audience memorable performance overshadow my courtesy  reduce rather  also  run  oppose actor level  idea  sir   normal  might almost incomplete without go right window   normal  reduce puppet  sure road hardwood intend  make breathtaking theatre  messes fin courtesy redress balance movie  restore equality relationship  man come long way since early appearance brutish  new wave  picture become darling vaguely leftist   middle  class ashamed  brutish cinema virtually commit hard  kiwi quietly concentrate theatre apart roles keep wolf renaissance substantial movie   appear  blink unaccustomed bright light  be    be    dresser  mark return  still fizz energy talent  shout world large  still  big movie assuredly great one,positive
movie deserve another look  it see  first look  young come    base play name  story old actor head tour repertory company inland world war   deal stress try perform night face problem bomb theater company make old physically handicap actor  young  able body one take military service  also deal relationship various member company  especially dresser  far sound rather dull nothing could truth  tragic overall  story tell lot humor emotion run high throughout  two male lead receive scar nomination good actor deservedly  strongly recommend movie anyone enjoy human drama  theater  especially  ever work backstage capacity  backstage goings make another facet movie fascinate viewer,positive
film detractor  journey fey dresser may offend folk   frankly  need good smack upside head   film top notch every way  engage  poignant  relevant  fin  naturally  large life  journey make ideal foil  think performance terribly strong lead  journey character provide plenty dark humor  period well capture  support cast well choose  see savor like fine cordial  wish do already    sigh,positive
alert fin tom courtesy brilliant sir dresser  course play brilliant begin nothing compare immediacy collegiality theatre  think listen well theatre  screen become intimate  unclose  theatre  witness subtle change expression   see  well well listen  play movie wondrous  move  intelligent  illuminate  backstage story company  historical context  two main character  parallel character  hear   get see theatre  it imagine produce much day   please  favor  get video,positive
fantastic cinema experience  really enjoy see truly magnificent film theater come  nothing add  except terrible shame sir alert fin still it accept amps  america academy   roles film tom ones  murder orient express  volcano  name  nominate scar   dresser arguably highlight  yet   be    be   know  scar popularity contest  america like brutish actor actresses   scar go  enemy iron  dance  anchovy hop  gemma tompion  lend jacks et   deserve award    always leave sir fin empty hand   be    be   hand  give john wane maria tome  cousin ninny   it know  laugh cry  be    be   see two lead dresser  wo it forget art act  watch film enjoy  recommend everyone love art  be    be   give  excellent film  point miss material    theater   be    be   note  criterion much strong mob  cinematic masterpiece last forever,positive
be    be   ask  great screenplay base one fine play latter half the century  two fine emotional performance journey fin  realistic vision war time onion  great support cast  film take emotional rollercoaster humor  sadness  loss fulfillment  theatre even effective  true rating scale,positive
many movie think see movie like  a it count sure seem like movie maker try give hint  remind often movie  become big distraction  one borrow memorable line come movie  day tomorrow  one line  bad movie borrows much many movie become bad risk  be    be     be    be   see movie  despite downfall enough make interesting maybe make appear clever  borrow much movie never go overboard  fact  probably find battening hatch rid storm    corner butcher play character well  never fan butcher nearly give guardian  surface good fashion  corner carry movie swimmingly good corner ability  it think my robins anything success  be    be   support cast around play part well  problem end  character use much  be    be   nitpick save wear tear  enjoy movie  part work  work well enough keep head water  it expect smooth ride  be    be   almost,positive
dresser  one film perfect really struggle find something like  write road hardwood  former dresser legendary donate wolf   sparkle energy true love life behind footlights  be    be   sir   overbear actor main focus play  alert fin joy watch  whether complain lack storm blow  wind   bit king hear  chat faithful stage manager  make  eleven catkins  good ever  old time  normal  camp dresser  tom courtesy give fabulous performance  wiggle around beck call hear   collect bottle go pub  bitchily disparage former fool  my  often mention  never see     be    be   engage support cast  toward fox openly  typical arrogant second lead   vena walker ladyship  corkwood west replacement fool  many others  be    be   film great energy  bring greasepaint stage origins  true  it notice  well do indeed,positive
watch dresser even  see  dozen year ago  be    be    big  movie  it try make big splash  god  brilliance two lead leaf speechless  alert fin tom courtesy nothing little amazing movie  be    be   dresser story sir  age actor  fin   dresser normal  courtesy   sort valet  put production king hear blitz onion world war   two man  dependent upon  sir almost helpless without aid normal cajole  wheedle  bully get onstage the performance hear  normal live life vicariously sir  without sir need  nothing  think  anyway  be    be   film  plot secondary interaction character   require actor high caliber bring life  fin  year old  completely believable old  sick  petulant  bully  brilliant stage actor  hiss fumes fellow actor even take bow  courtesy little convincing mince dresser  must sometimes act mother valet elderly employer  employer really wrong term use  though  although  technically relationship employer employee  time sir normal act like nothing much old married couple  be    be   yes  others cast movie  question true star fin  courtesy  marvelous script road hardwood  say it fine performance  notably eleven catkins stage manager make  wonderful scene sir make talk old desire  old regret  might  be    be   although it get talked day  worth remember dresser nominate five academy award  good actor nomination fin courtesy  good picture  good director  peter hates   good adapt screenplay  be    be   remember good movie  it prepare completely mesmerize begin end  want see example great act  hugely entertain  encourage see dresser,positive
blue fine stage play rube even finer film author adapt life story screen  brilliant film ignite screen rich color  fine music  brilliant edit  superb direction gorge c wolf  cast stun make encore view compulsory  yes  good  be    be   story base author life child junior   marcs carl franklin  raise inimitable home soulfully empathetic rather  nanny  cross  path   lady devote life aid disenfranchise transport south  mental hospital  street  new york  boy recall lesson learn life inhabitant house  odd character painful past  disintegration racially mixed biological family rescue nanny  myriad character home numerous outline portray fine actor business  terrene toward  rise be  to de  beautiful careen ego  louis grossest or  wright  erne godson  woodland  jimmy suits  patrician wet  many gray  live scriber  callant  you dyers  hill harper  list go  be    be   course film introduce cruelty racism  history desegregation  dynamic drug abuse violence  infectious joy african america music contribution musical culture  courage one fine woman battle hardship world dish maintain dignity come contact  path wholly submerge role  role make shine like beacon reason world chaos  offer one stunning performance past year  film release theater instead ho movie  without doubt would add scar place along side golden globe award  be    be   entire cast exceptional wolf handle act story like master  like riff jazz piece  paste tiny moment conversation character junior along flash scene story matrix dance fests local club brim top incredible blue  jazz  dance  joy  production crew mount little miracle picture extreme care never moment attention lag momentum story  highly recommend  almost compulsory view  grade harp,positive
blue drama  detail life strong woman name rather cross  path   rather refer nanny know  could easily call wonder woman  epitomized strength  power  confidence resolve  own home use house every type person society would reject  tenant consist lesbian  psychotic war veteran  amputee  host vagrant make home mile away ordinary  successive event rather take stride handle flawlessly  it dictator devoid compassion  fact quite opposite  display compassion almost fault give shelter refuge many seem overextend  be    be   good job  believe role right alley anyway  movie even keel never stray rather  course dramatic moment expect  nothing ever shock profound rather,positive
blue touch story nanny  woman give help need  tell viewpoint boy  take nanny mother it quite task  be    be   respect movie three main reason   touch  sappy  tell real fashion  without lot aggravate storytelling baggage  end quite good  teary    be    be    although clearly film  set black community  new york  it wear ethnicity sleeve  story stand strength character dramas  comedy  surround life  preachy  simply good  be    be    great soundtrack  a it beat r  b chico blue    be    be   generally act strong  universally  performance simply it hold character actor suppose portray  consider movie  expect  be    be    imperfect likable  good film rainy day,positive
every film come along character know love  film see people know portray screen  cinema good  be    be   blue film  set upstate new york  story surround rock solid woman  foundation community   base true story film  tell child accept  child  rube write screenplay  be    be    gemmy winner  path star nanny  woman wit  drive determination help others board home  wrestle infidelity young lover  bill cross  play   scar nominate terrene toward   be    be   make mistake  see film amazing performance  brilliant role  encompass person know  perhaps love  be    be   blue already do  sure pick local video story today  be    be    already gemmy  golden globe screen actor guild role  be    be     toward scar nomination role hustle  flow,positive
