text,class_label
love return nest  yet another  fail relationship  find assigned jury duty  plan  somehow  get  realize defendant girl serious crush since first grade  be    be   live past tell people feel towards girl  play camp   love remembers feel everything power clear camp attempt murder  stay away real bad guy time  succeed create successful film time  be    be   hear it old city u  also know tie ponce de lean  backdrop good place start  unfortunately  thing good movie  local police inept  judge idiot  defense counsel everything power make look like jane  it know whether blame director poor direction  let cast put hapless effort  be    be   short  movie boring  could even sleep  star,negative
be    be   never ever take film good look title  be    be   although start well  film suffers imperfection see films  like certain moment writer end film  end way nobody suspect think way ingenious  be    be   film list top garbage list  be    be,negative
four thing intrigue film  firstly  star early pope   popular  fame   always pleasure watch  secondly  feature brilliant new zealand actress rent own  thirdly  film association new zealand film commission  fourthly  friend recommend  however  utterly disappointed  whole storyline absurd complicate  little resolution  pope act fine  own unfortunately underused  actor actresses okay  unfamiliar  aside nice riddle litter throughout movie  pope own   film it good  moral story  it watch unless really want,negative
shot mountains  low country south carol visible background  heaven sake  reset location  coastal mountain south carol  period  be    be   lame visuals  beautiful  story limp along  be    be   really it understand hit book  although admit one it read yet  usually read book give film miss  nothing movie make want buy book  even borrow library  be    be   verdict  mermaid chair seem pretty shallow moi,negative
exactly good thing say  fantasy   mention previous reviewer well    be    be    to be extraordinary  beauty  shoot movie give even gather run money  high compliment indeed  nudity brief discreet  look face enough  be    be   b  green island set  sun blue water  be    be    story  dialogue abysmal time unintentionally funny   touch woman     peter hooter character slimy jerk  to overplay naivety character  work dialogue bad unfair blame actor  fact keep say name  amir  almost every sentence major irritation   oh  although film set green island  hardly green word heard  apparently everyone  kid old people  speak english whole time,negative
film massive yawn prove america it get hang farce  even already write  original film  home gannet  witty comedy error would rate   it linguistic translation  certain absurd chain event skip entirely  rob film original clever farcical nature turn cheap  oops go trouser  style farce,negative
girlfriend stun bad film  minute would call quits except curious see film could possibly redeem  do n't  be    be   a it understand praise give film  write downright awful deliver bad act see long time  be    be   one thing especially annoyed film often people talk unnatural pause line  understand use pause create feeling awkwardness  like happiness   type pause  simply bad direct  film might actually much good subtitle  maybe overseas market good one film  insane dialogue bad act would it notice much  be    be   generally like type small quirky film  real blonde  walk talk  lovely amaze   one fail many level consider one bad film sit last year,negative
see movie recently  although appeared  hop see entertaining movie  let tell  princess blade nothing compare alumni   princess  talkative  may notice  remind jean clause van dame  star make point  beat crap opponent  entire movie  wait hear little confession like  fight  love trust  wait vain  crappy movie  crappy dialog  it watch unless want bore mind  bad  end wonder manage scream frustration half hour  approximately  give,negative
remember watching film back  first come  awful film  act atrocious plot flimsy would blow away breath wind  think put sleep one occasion  tire remember  please avoid cost well still tooth take anaesthetic to would entertain  pity could it give zero negative score  wish waste money get one video shop say tape still brand new practically hardly surprising film poor  remember right sat  watch girl really want go  fact sit next still enough keep awake that bad film,negative
former brat pack actor round pretty boy rob love star film set high security america prison  gut feel character go popular wrong reason like tibias first series of  proximity  kind film   like  man run  film like fugitive  also make nod theme punishment justice names coburg put cameo spokesman justice victim pressure group intelligent discussion society treat criminal completely ignore film degenerate tire old cloche shoot out car chase,negative
lot horror fan seem love scarecrow  wo it popular say find rather boring  idea behind interesting  seem drag much  think main problem set darkness  sometimes horror film set darkness work  humongous   scarecrows darkness whole film  lot time hard figure actually happen  although shot scarecrow creepy  hard even see  little light use  perhaps could good  be    be   many film involve killer scarecrow knowledge  apart dark night scarecrow  much good  would recommend scarecrow day,negative
earth coin firth pointless film  really strap cash   be    be   film it clear want  grief   exotic place   ghost   vehicle my darky  muddle  muddy mess  be    be   seem sort idea italy must good   italic something offer language  end girl want go back gangland  be    be   pointless episode beach  church  busy road   anybody care simply it clear  be    be   also yank woman film  it clear job  seem make vapid  inappropriate maudlin comment girl  suppose pedophilia    be    be   pretty dreadful mess   give rather it charm utterly ghastly film,negative
first howl  introduce world werewolf exist somewhat organize  plot film make sense  to reporter investigate attempt uncover truth  end kill many include boyfriend become one  show world exist transform live to  special effect laughable first movie it get good one  whether transformation bad puppet cheesy computer graphic show superpower  be    be   plot line it bad  must kill leader werewolf reason  wo it destroy werewolf really it end threat werewolf  want kill  think cloudy reason really get lose film  be    be   film  end  minute montage movie watch every scene one female werewolf leader rip top expose large breast band play crowd werewolf   be    be   thing make movie even watchable lee,negative
movie   horrible       wo it believe hunk junk even movie     critter well    critter pretty frigging bad    bunch stupid teen crash desert  find old run bungalow  end fend horrifically badly stop motion animate spider  pardon french  act bad hell    person write probably it even know spider  spider live colony serve queen spider  spider live colony           movie  piece crud    end  marine suddenly pop kill spider without even call     see copy movie video store  douse gasoline throw match,negative
wife watch during encore action past week  bad horror flick either u ever see  predictable dialogue  wife guess line speak   hokey special effect  screenplay drift place  think part annoy stereotype various character plot  mention gratuitous scene two young heroine movie  neither real purpose bare certain part anatomy camera  movie categorize comedy  horror villain movie  spider  stop motion animate believable little  a it say would do well job make film  amateurish it even  b  movie  somewhere closer   movie   f  possible  think even science fiction would pass one,negative
usually love movie  give good old b movie day one simply awful  act    terrible almost point turn movie completely  think see time bad one right attack killer tomato  honesty  act film  be    be   find actor clumsy lead extremely dull  movie absolutely nothing go  may ask ridiculous question nudity scene  producer think nobody would watch leave  think probably right  oh price tingler need,negative
one movie watch bad  movie watch see shitty craftsmanship  supposedly horror  imagine anyone afraid bug  especially one translucent nature see actor leg behind  be    be   even budget  little bit attention detail even attempt make movie believable would suck fun right  would replace actor entire story  nothing make fun playing  would stop minute  put quality show like sponge bob square pant  her her her    be    be   strongly recommend brent piper get quintain really pump feces  be    be,negative
watch movie base comment say bad funny  need warn movie bad special effect ever produce  make science fiction movie look like work art  funny time  annoy part  compound problem seriously pathetic special effect total lack logic characterize majority event depict  one favorites three character drop hundred foot tunnel create arachnid arrive find fully light  apparently arachnid also manage hook power grid  impressive  one example  worth  music suck  act suck  two cute girl annoy  obnoxious guy annoy  call handsome lead man geek  black girl fall fool  father bad actor ever see  sure brief moment humor possibly make experience,negative
confuse decent arachnophobia  film low budget cheap ripoff movie  one bad  actually entertainment value level  numerous unintended  think  laugh loud scene  it expect much film  actually bad imagine would  be    be   cliché ride predictable direct video mess  fortunately  it take seriously  act  expect  quite scar caliber  special effect poor  bad would think would  poorly edit score intrusive,negative
pick  spend time albino region new york  know couple people movie happen upon chance  attempt comedy lame  compulsory scene sicken  plot nonexistent  act among bad ever see  it even get start special effect  realize low budget film make small independent company  go shift horror flick giant bug  it make giant bug completely unbelievable  people want see giant bug  half fun right  go make giant bug completely unbelievable  little get actor make sort allusion fact   idiot  it  capture stunt double     prepare waste two hour life never able get back,negative
way  respect arachnid  clearly mean tribute big bug movie fifties  special effect look terrible  little film it feature chi  however  hand  a it respect film much load rubbish  act terrible  special effect  mention  impossible take seriously  see one giant spider blown  see  get bore rather quickly  plot follow bunch people unlucky enough plane crash meteor shower  go house area  happen house man huge spider use use circus attraction  confidently around time  meteor shower cause giant spider rise underground  character film poor caricature  none anything even resemble third dimension soon begin thoroughly bore  get feel director brent piper clearly it much work film  it make arachnid worth damn  overall well giant bug film  therefore arachnid it get seal approval,negative
angel demon   clearly something bad happen on toward  it know exactly  something go wrong  be    be   toward always decent workman director  never mistake artistic savant man apollo excellent film  parenthood pretty good even angel demon a vinic code fun romp  addition none film downright awful   note see neither french stole christian new film head montage say plastic   whats toward manage hold quality devise genre star drive scar bait  beautiful mind   star drive costume drama  far away   star drive revenge fantasy  ransom  comedies prostitution mermaid  night shift  splash    be    be   angel demon center poorly direct shot film  scenes dark  camera angle wrong  actor block others shot whole affair often focus  make tell already confuse story even muddle  be    be   can brown get pick lot find a vinic code fun readable romp  sue   movie version a vinic code keep go next vibe book add attractive cast attractive location shoot  be    be   angel demon however take place claustrophobic confines vatic city since toward it allow film many real location end lot run around chi back lot  entire film rick stoves vatic city special instead actually visit holy city point camera  rick use legs brick second hand art book tit erase  be    be   a vinic code still think intriguing central mystery  sue   demon angels story consist plot illuminati  roll eye  destroy vatic  idea take position school deaf around world rap every student as repeatedly  oops bad  apparently vatic it need help one  be    be   anyway plan infiltrate rope large hadron collider  kill head priest  steal three vial antimatter  beg question  hadron collider create antimatter  capture antimatter create  e collect   perhaps fear gorilla attack    head antimatter gather vatic priest  get antimatter go use incredible destructive power take world kid  unfortunately illuminati it quite grasp pinky brain level sophistication yet  instead current pope die conclave time  top seed cardinal final four pope tournament kidnap illuminati kill one one seven style  good sport however leave clue every murder like satin theme riddler  oh last kidnap cardinal antimatter it find time rick stoves go straight venire next year see decent fresco  satin theme batman save day  okay story truly awful poorly tell  maybe one film save great performance  true character study  okay know go   tom hank give incredibly wooden performance simply look awful  also old play character twenty year   love interest israel actress eyelet purer zero chemistry either hank screen  swan play pope personal boy iris man look like break musical number moment provide one steal lucky charm  be    be   plus side stellar put fine turn head vatic security far know deaf child rap make film put ahead vatic critic little one area,negative
neither read book see first movie receive pass preview show  expectation  be    be   angel demon  muddle  convolute film lack direction believability  little character development never find care plight protagonist  reverse true  interest see antagonist would succeed first half film almost exclusively focused illuminati  be    be   film jump location location little explanation reason expect viewer believe everybody movie ally first meet  analytical mind realize highly improbable  be    be   climax extremely cliché leaf ask happen wonder nobody consider point  feel tack unnecessary  be    be   actor particularly believable role  mostly find difficult believe scientist  professor  man church would act manner without regard consequence action  event happen plausible slight pace movie questionable character jump around tight schedule question protagonist manage get location location time  every time  be    be   please part film cinematography  find beautiful film watch mess  find would worth pay view theatre,negative
critique tell story little friends go watch angel demon movie first night come  even though school night   angel demon worth   two four read book  it  guy  wear pink skinny jean  little eventful part even watch abhorrent angel demon  be    be   movie start lab antimatter create another process go  apparently someone know something  notice confuse  it get happen  make antimatter  victoria find father dead   illuminati symbol send lagoon printout  burn someone chest  take x scene  take killer   pretty much  take corn symbology connect  take assassin replace religious  brutish dude  take illuminati diamond  take victoria narrate scene  take languid fight assassin  brutish dude crack   take press dude follow around  take death fourth cardinal  take fact camerlengo become pope  take camerlengo grand scheme  take lagoon helicopter land island toward end  take fact victoria father scientific priest  take lagoon fun unfortunately  take victoria pal appeal  be    be   movie completely lose focus detail  movie act horribly  one must admit  though  good thing  example  sit chapel recreation must extremely difficult extremely well do  explosion scene   screw movie ruin book people it read,negative
extremely fast pace  exhilarate  interesting  detail rich book  huge shame film none quality  tom hank  mild mannered portrayal robot lagoon laughable  name change key character  huge deviance original story line  poor accent play swan  make bad book film ever  be    be   huge fan  book  high hope lavish  true book detailed movie  would start finish book  leave want  be    be   film really depress within it minute  be    be   impressive  sorry  could it even finish sentence without laugh  be    be   short  victoria token hogtie  second surrey thou nice ala romeo  be    be   would recommend read book understand  on toward must insist make another book film  would happy save   kc zinger meal chicken wing  far entertain deeply satisfy,negative
go movie expect little action mix strong story line  understand change write work movie must make  many reason  be    be   change relationship scientist  father  daughter book  director corn eliminate thus cause scene camerlengo director change camerlengo head swim guard pope office  be    be   on toward make sure get dad insert cardinal hayseed accent miss symbolism  lagoon camerlengo ascend heaven helicopter hank character land river priest land upon chapel describe christie image  be    be   point film need remake director job,negative
recension  angels  demon  be    be   movie direct on toward  also make famous movie like a vinic code  man  direct also famous series  famous actor tom hank  a vinic code  green mile  forest jump    swan  dream  moulin rouge  star war  phantom menace     be    be   begin shock change begin movie big  change father victoria extra  eyelet purer  someone else  silvan  come   another change robot lagoon  tom hank  never go corn  nice could film location corn  be    be   movie go  spectacular car race come  also like part christian archive much destroy work galilee  funny  also funny lock archive second time get  robot lagoon destroy half archive bust  electricity get  be    be   find stupid robot lagoon go helicopter  camerlengo  swan  get alone  another detail movie camerlengo adopt son pope  book real son pope  be    be   give good act performance say have play inspector  bad act assassin  play lie baas  think underachieve  madam apple play fabulous  be    be   think whole movie underachieve director on toward make many stupid change  would rate movie,negative
historian  movie wrong hurt  try watch open mind  go delve movie anything matter nature little homework regard history  location  church protocol  et camera  stop play dumb audience  please  u actually put shoe venture theatre something nature  worthy theatrical release come town  little research  ask   book base somewhat joke  basically  take novel many error decide make screenplay  pour million million million dollar make incredibly promote world distribute theatrical release time anyone take time little research lot  know several colleague would do credit alone little give body student assignment several week research various aspect pay someone knowledgeable couple buck run trust  plenty starve historian would jump opportunity present,negative
firstly love book  popular a vinic code although doc film well receive  like buy do  however  chance ever want watch angle demon ever  be    be   film barely resemble book  fact general premise story  be    be   start film disappoint  book robot lagoon receives call fax killer  director corn  find body father  a it remember name  request lagoon come  use super fast plane  book people know technology father daughter team create camerlengo  film however  massive team involve  tension never  find et  be    be   leave rather change whole part story massive mistake mind make poor movie  change everything happen  camerlengo confront pope lock room  killer shot video wheel chair  commander rush get camerlengo shot  film commander room shot   err think get right  bore a it really remember event film    be    be   love interest victoria robot book it corn arrive indeed fly research work  book four kill  film last one four survive fountain  book victoria kidnap robot rescue kill assassin church illuminati  blow like film camerlengo  bit robot confine stone coffin  save mickey mouse watch alarm  of book lead believe lagoon bail helicopter  fair enough say bit far stretch  important film  race back film  mention victoria adopt father become involve  also important get know character victoria  be    be   one bad film see  would leave early  brain go numb lose use leg temporarily  really really poor attempt one on toward fine  fact  get work beyond    want money back,negative
on toward  editor  one job  follow guideline book  rich    mysterious    move  highly cinematic approach   be    be    change everything mean everything  leave something right call  angel  daemon    be    be   really love book find hard see treat way   be    be   wonder opinion can brown   film  be    be   really patience sit right  change make  pointless,negative
implausibility plot note several commentator  particularly immense amount trouble for would go  sheer impossibility calculation would make  include lagoon go decipher clue minute  brand  second later give order  minute later  run  literally  around charge operation  real life  would shock   usual thriller  assassin it kill hero  give lame explanation list kill  though every innocent bystander shot  always use independence day hallmark truly awful film  u president commandeers jet plane beat alien  ha ha   effort run close  implausible film  angel demon contains remarkable number predictable incident  it laugh knowingly assassin go get reward  felt like shout   go blown   it know heroine go find body lab  it spot baddie  technically also  film awful  dialogue often indecipherable clear  race across come next church accompany deafen music  moreover  many scene look like mud  one redeeming feature shots come look like vatic  achievement  sure vatic official would want dross shot around it peter  interior convince  come magic place  enjoy see fleetingly,negative
follow book  really sad disappointed  look forward see movie  however  read book  maybe recently  might difficult remain objective  wife read book  love movie  be    be   reason disappointment   corn involvement  go wind  shame  small part start  antimatter create  even stick fact   fact victoria father burn first illuminati brand  lagoon get involve would perfect start movie  storyline  decease  pope camerlengo completely go  completely screw motive steal antimatter  storyline lagoon victoria tetra completely nonexistent  be    be    flaky storyline  understand can brown allow put name  maybe revisit film year time  remember excellent book anymore  fat chance forget book afraid   be    be   really sorry negative review  spoil expectation,negative
go see movie tonight  try keep open mind  hop enjoy movie expect different book  considerable difference book  much like change make divine code  go see divine code think process manage enjoy film  spite  change book  still enjoyable  fill action  process decipher symbol interest mentally stimulate  unfortunately  angels demon disappoint almost every level  throughout movie  symbol find figure quickly  without interest viewer  blow past various illuminati symbol quickly chance get look appreciate work  final illuminati symbol  interest creative one book  replace cross key symbol  opinion  miss opportunity focus spend little time symbol  lagoon character  overall  movie poor interpretation book  fail attempt action movie  thriller,negative
personally  book well write  amaze  thrill piece bring justice movie  watch movie  morning see major part book leave frustrate  see affect  different  outcome movie  something desire movie   lack plot  be    be   someone read book  could see movie would see invite entertain controversy suspense  however dedicated reader read seven time  see strong connection two  movie novel  be    be   major character miss  killer  abrupt turn plot survival last cardinal preterit  plot movie slightly strewn thus leading different take conclusion story  assassin portray common white man  compare novel portray muslin  motif book predominately base tie illuminati  however  movie  motif base money seem like work personal tie task hand,negative
