text,class_label
movie serious nerdy look kid name cutis kill people  two psycho kid kind cute cutis kid ugly wear huge  brown  ugly glass  actor probably wander wrong set really suppose go revenge nerd  be    be   another thing hate much movie cutis take sweet time shoot people  keep finger fast forward button take long voice  sound like fourteen ten  another thing hat keep smile like idiot point  be    be   put annoy kid freezer somehow find flashlight  it make sense neither music  music it fit scene  be    be   movie slow  bore waste time  watch different movie birthday,negative
seem ever since  every two three year get movie claim  next officer gentleman   yet one movie live claim movie different  be    be   get usual rip scene hang   want dor   instructor give richer be character overdose drill hop quit  be character come back girl  be character realize instructor great  et   movie predictable sun rise east horribly miscast top  corner play usual  wise teacher  character  character play  really get sense limit act ability  butcher terrible richer be character  miscast act skill barely notch mean reef  be    be   main problem hang wannabe two main character amazingly  never care either little butcher character finally turn around  like be hang  go   movie leave plot point unturned seem never end say  oh wait  forget close girlfriend story  happen graduate story  six plot point movie   baffle great  review  see  general public opinion never cease amaze,negative
mean spirit  repulsive horror film murderous child  sudan totally waste minute cameo  even though receives star bill  lie brown fan  want check  since naked couple shot  others  avoid,negative
bloody birthday totally rubbish slasher movie begin end   be    be   find act pretty good consider genre movie obvious low budget  it know go cinematography look ghastly  way  maybe bad transfer do maybe always look like  it know   be    be   really redeem quality speak  death really gory  would it bother  good thing do minute interview producer man amuse honest  it anything good say director end hunt admit movie failure  would like remake believe decent plot  however  die guess someone else take challenge  way thing go last year would it surprise  little one remake per week cinema day  could it bad original suppose could it care little whether get remade,negative
make film kilderkins premise  two effective way approach  either make realistic possible  create believable character situation  make fun possible playing laugh  something maker  silent night  deadly night   example  equally controversial subject  killer manta   people make  bloody birthday   however  neither thing  simply rely shock value image kid gun  knife  noose  arrow  higher hand  result offensive stupid  whole film look like bad idea rush production  keep release several year   redeem tiny bit good performance kid  sloppily make,negative
people say child annoy u think ya little cousin annoy say little  child turn without doubt annoy bratty child ever encounter  film   let start blonde  debate  slut girl  mean come wear mini skirt  stupid frizzy blonde hair freckles red bunny like face  act innocent  next second child  geek  think cool  long range shooting use silencer  coat gun  evil bratty smile  next kid quiet one it care that  film anger child intelligence enjoyment get cousin keep bitch,negative
bloody birthday  odd  time  humorous horror flick along line mike  little intelligent version good son  be    be   set small californium town  three baby bear height eclipse  planetary alignment mean somehow bear without emotion  ten year later  three little psychopath take kill spree  away parent  sibling  teacher anyone else irritate  one teenage girl know truth able stop  explanation baby across world bear time it equally twist go   be    be   slasher film  tame term violence gore  suppose highlight problem cast child character killer much expose young actor  instead  amuse little disturb see three plot murder carry plan use gun  knife crossbows  main reason it descend totally ridiculous child actor convince role way slyly play little innocent front undiscerning adult show dark side girl know truth  be    be   bloody birthday  rather mediocre horror flick  scar little blood  shock factor kid killer  bit unique way  one watch nothing else,negative
poorly act  pile trash  course  anyone it realize pick box video store probably it right judge movie first place  thus  rate aspect film actually care scale   be    be   violence gore   genre  death  gore almost nonexistent  anyone look little blood probably look elsewhere  redeem quality fact kid awful thing  raise bar little  be    be   suspense   okay  feel bad anyone get scar trio dorky look kid  be    be   nudity   lot footage three different woman  one to j lie brown  two scene  little show  be    be   unintentional humor   good laugh kid try act scary   bad  funny bad  be    be   overall   unwatchable  fun moment  enough nudity keep attention entire movie  however  watch movie big fan slasher flick  definitely fall low end scale  way bottom  real downside disappoint end  almost ruin movie,negative
formulaic slasher film  one star three ten year old  bear lunar eclipse  killer  nice  huh  little bit gore nice nude scene may make worthwhile diehard fan genre  others beware  be    be,negative
cover girl  lackluster wait musical absolutely nothing memorable  save signature song   long ago far away   film come gene kelly really hit artistic stride  evidence burgeon talent  mostly play sidekick rite  problem  rite gorgeous  doubt  simply compel screen presence  always find want like actually  movie exception  simply good actress  even good dancer  good look  something vapid  movie suffers  be    be   grade  c,negative
rite play brooklet nightclub dancer name rusty specializes cheesecake chorus revue  manages get cover national fashion magazine  impend success solo  romantic offer around  smite boss gene kelly chomp bit  terribly tire piece technicolor cotton candy  unmemorable musical sketch  two bad irrelevant flashback  portray grandmother   kelly  always  dance well act false sincerity  serious  insufferable  rest time fly adrenaline  script lead weight  even give support player pail silver eve garden good line,negative
like sing  rain   cover girl  trio two guy girl  cover girl   pail silver  genius  comic relief  correspond donate condor funny man part sing rain   cover girl  gene kelly love interest rite rain   debate refolds  comparison end  be    be   whereas  singing  rain  classic america movie musical  cover girl  mediocrity incarnate  story it complicate  rusty park  rite  dancer nanny acquire lowest nightclub brooklet  rusty decides enter cover girl contest sponsor wealthy publisher  john cougar  make unsuccessful play rusty grandmother year ago  cougar introduces rusty roadway producer noel wheaten make star  nanny feel slight rusty start show late rehearsal nightclub decide close club go road entertain troop along sidekick  genius  last minute  rusty altar noel  realize error way run back nanny  live happily ever  be    be   gene kelly little developed part movie  find own nightclub madly love rusty  cougar wheaten act like besotted teenager toward rusty pail silver delivers thoroughly goofy unfunny shtick  interest aspect rite performance scene get drink  foreshadows happen real life  anyone read biography learn dislike  pin away normal home life could never attain eventually begin drink end flyblown last year life  be    be   almost songs cover girl tuneful  gene kelly one really excellent dance number scene dance alter ego   earlier  trio another number pale precursor make em laugh  sing  rain  be    be   annoy thing cover girl  way rite put pedestal  couple decade later  sequel welch problem  actresses late career would always try find script showcased act ability  want know actress  pinup girl   unfortunately  cover girl  example use exploit woman financial gain,negative
wow  another kelvin corner hero movie  postman  tin cup  waterworks  bodyguard  watt earn  robin hood  even baseball movie  seem like make movie specifically center attention  character almost always  heroic  flaw  greatness  fall  redemption  yup  within it minute movie  suppose awe character  build  be    be   time story  story   collage different movie  it need spoiler  see movie several time  though different title  know happen way happen  like mix officer gentleman  easily good movie  watch see kind movie make  also see good slightly underrated actor  mussels  play hero,negative
rite stun time   reason watch silly film  despite overdone lipstick  rite one anytime glamor woman  fact  couple year a it imagine anyone look good  except maybe tailor prime  be    be   anyway  costar show  gene kelly  play normal likable  little kind guy know  sing  rain    kelly  nanny acquire  pout much time  pail silver  love to  set  bilbo   stupid  genius  cringe listen dumb joke  stupid  be    be   visuals good great technicolor  almost look terrific  get see lot pretty woman    unfortunately  story it much  center around decide career choice  along way  get normal shabby treatment marriage get end   unmemorable film  except showcase beauty,negative
hurt watch movie  really  want like  even go  shot obviously little cash  look past told appreciate inspiration  unfortunately  although appreciate film level  act edit terrible  last  minute severe territory  minute film drag  rating one good far  fear friend family might say one  transition  dear my editor  purchase first copy adobe premiere make main goal use goofy transition come silly program  anyway  good actor  little passion  appeal edit make decent movie,negative
film seem well make  effort make promote film woman  aside  film also profoundly disturb justifies manipulative psychotic machination character profoundly disturb  see promotional material  might think poignant film relationship reach end  none suggest really disturbing central premise   be    be   woman threaten suicide unless soon ex agrees relive treasured memory relationship  tell unfair  say little  threat  tesla  purport protagonist  suggest  life fair    be    be   huh    character also use tear manipulate former lover stay  coax rally orient behavior  initially deny motive  assure  it    be    be   reverse gender  lead play trace gold brain could air feature length lifetime title like  hostage obsession   medically accept definition sound mental emotional stability would encompass tesla behavior film  be    be   prop listen thoron play borderline psychotic  manipulative ex  perhaps well person  male female  could watch shiver run spine,negative
sorry  hide  get     jack l hide  jell  hide  bad act side hardcore porn  mention script apparently write undiagnosed learn disability  be    be   hackie hide inherit old mansion grandfather never know  guess  yes  inventor special formula slowly take one body mind  yes  my hide   be    be   despite nice skin scene  film fails register feel emotion uncontrollable laughter  be    be   much poor hackie try a it stay away granddaddy special formula result hour half waste time,negative
hide start like normal day telemarketing individual hackie hide  producer cabrilla hall  boy  robot  fire take personal call work  however bad news call take lawyer inform grandfather  bennet  recently die  leave mansion  fortune  it stuff like ever happen  sigh   excite hackie head  make right home  look thermostat late one night hackie stumble upon secret room grandfather stash bright red formula invent allow whoever drink change appearance  bit porky side hackie finally settle glamorous  blithe meet   however hackie well look altered start take control   be    be   write  produce  direct role think hide complete total  utter crap start finish  simple  straight forward  accord open credit hide inspire  classic robot louis sternson novel strange case do jell my hide   frankly my sternson could see do story turn grave  start think hide basis intend horror film  mob certainly list it horror apart bad  would say hide software porno anything else  extremely tame  sit  watch softer soft porno crap watch proper hardcore stuff actually deliver good   question ask  even good porn either  besides far soft dull  bore  scene  far  intelligent aspect film title would quite clever fact another film use hide   title last century  judge mob plot summary sound hell lot good piece rubbish  one film watch see bad hope never get opportunity  be    be   director obviously work low budget excuse day  shot digital camcorder film look cheap  instance chi look like come intend homeboy  final shocking  twist probably bad morphs effect ever see  pretty good laugh scene hackie breast grow via terrible chi  another thing  film take far seriously  subject matter suck  far predictable  make poor film maybe dialogue intentionally funny dirty porn talk film might fun watch  alas it it  forget decent horror  violence gore it apart surprisingly bloodless decapitation end  be    be   technically hide home make film type stuff  photography flat hand hold point  shoot variety  music  production design  special effect suitably low standard match script  act awful  seriously bad  be    be   hide opinion load crap  one positive thing turgid film think  proper film lover almost impossible time try find redeem value crap  definitely one avoid,negative
india  often compare prominent world film maker regard genius filmmaking  yet prove make frame look visually good  without offer much food pure cinematic pleasure derive cinema old form art  be    be   would like claim portray someone see beautiful movie make around world  still thoughtful bit educated film goer identify film contain innovative ingenuous plot  contain linger effect afterward mostly contain ridiculous end lot melodrama  see profusely india movie  be    be   overall  successfully confirm distaste film  be    be   sorry board claim otherwise  suggestion  watch beautiful cinema make around globe,negative
film  rent title  black voodoo  avoid  expect flick  get dull  standard  ghost extract vengeance   case ghost religious cult leader try refuse treatment  plea ignore die operation  result  spirit possess nurse sherry force commit act murder  voodoo connection one three black character  case blind football player  mom practice voodoo  film slow dull  standard end provide excitement  follow horrific stupid end  warn  spoiler   be    be   woman actually manage defend murder charge say possess  movie slow  bad unfunny  stupefy way  avoid cost,negative
first minute little fun it think see film bad  act  script  effect     et   rest run time seem drag forever every cloche dialog use effect  people seem really like horror movie make movie  adult language  bit brief nudity  gore except fake blood smear open wound  et  would rat pig early eighty pig nowadays  sure get r rating really  see america international release title hospital terror  see horror film past month probably bad film ever see  example bad  one scene something green come door  sure suppose screen kid green crayon scribblings  exaggerate  superimpose film  inside door  suppose something nurse sherry possess suppose  could believe lack pride show embarrassment,negative
come check terror hospital alternate title know pick  get original title  come find terror hospital one seven one real clunker  movie like usually forgive number reason  mostly unintended consequence feature every level production result little mild form entertainment  mostly amusement  none  instead  viewer witness redundantly unnecessary exposition drawn scenes character warily move room room  half film  forget try figure anybody   darken nighttime scene   probably wo it care  anyway  also random car chase sequence seem quite dull compare old driver end movie sleep  er  mean sat watch way back high school  really  talk mysticism  possession  killer loose  bad recipe trash cinema  unfortunately  nothing make even  good  trash  join aforementioned  bad act effect  bad act effect  one trash  pure simple  leave rack pawn shop box yard sale  reason,negative
hard film rate  truly deserve  perhaps even two   a damson film  exceptional  practically damson good  unlike many damson film  time nurse sherry almost look competent   damson film  know sooner later scrappiness must rear ugly head   be    be   film begin bizarre cult leader huge congregation  six  try resurrect dead guy look like make blue cheese  however  process  cult dude heart attack take hospital  apparently die  also seem like many hospital scene miss appear much later film  word  see film  appear possibly recover  hear later die  guy off  satin  however  evil soul a it die come back haunt one henchman possess nurse sherry  be    be    sherry obviously disturbed lady  demonic possession  time act like zombie others violently homicidal  ask   it boyfriend  doctor  think  perhaps  problematic     word  try kill patient  neither get exorcist commits booby hatch    oh  speak booby  movie romp title poster would indicate  bare breast  irrelevant plot see briefly   second  one scene   perv  movie  though place film  nurse undress patient  make look like film might  one time  design porn flick  be    be   bad movie fan  however  enough whet appetite  examples incompetence inability many actor deliver line it zombielike  even talk sherry  especially noticeable one final scene  never see heard stilted act dialog life  include end wood film  also cheap touch  bad animation  green stuff   doctor find murder nurse yet continue investigate house wall cover blood  get cop  good yet  army cop    be    be   despite problem  think good damson film  well  story it bad able build tension well  many false alarm early make heart race bit  also  car crash  irrelevant  come pretty well practically damson  be    be   overall  good film one people would bore watch  however  fan damson inept film like  deliver entertainment cheesy manner provide laugh,negative
ala  another corner movie hour long  credible performance  script go hurry get  first offer unrelated string event story  script center sandals wife  sandals fisher  fisher homes  end  real front story ever develop character artificially prop monologue third party  singer explain sandals  sandals explain fisher   finally  long it care anymore  learn something script meeting  three end doubt proffer one could make decision  end result  three use  one  another  another  hang past the yawn  able pick  despite transparent attempt gain point dedication coast guard  one wash first day,negative
buy vas  terror hospital   get home check mob like om legendary  nurse sherry     another one a damson  clearly learn minuscule amount filmmaking since  blood drachma castle  day  early effort little totally sclerotic lump  one mix little  add definite element variety surprise amid incompetence  sure half movie blind stop football player shoot breeze stack nurse  moment might cut away cackle disembody head satanist mastermind  nurse sherry run farmer pitchfork  wee bit abstract quick cut go effect possession scene  gratuitously halfhearted topless bit ever  god know else  forget  honest   dumbest piece sh  go  one run toward high end  congrats  a,negative
film open cult leader attempt resurrect dead member follower chant rebirth sun strike upon desert   bill boy  believe wholeheartedly power  get work collapse appear heart attack  unable keep alive  involve  doctor nurse  sentence attack demonic spirit invade curvaceous body nurse sherry   jill  target one use tool vengeance  force  memory inflict harm  sherry host body murder select victim  fortunately  sherry fellow coworker  nurse tar  marlin job  begin rather blossom romance blind patient  marcs  pretties golden   star football player  whose mother practitioner voodoo  marcs  knowledge  pass mom  tar find possession possibly save sherry murder everyone unknowingly  meanwhile  sherry lover  do peter desmoid  land  worry present condition welfare  be    be   well  first a damson film must agree detractor  film alone  seem hold together paper clip elder glue  animation see spirit take control sherry beyond awful rather laughable  little software nonsense filler  demonic possession thrown mix  sherry actually speak another voice possess   naughty nurse behavior   three nurse focus film quite rally active  little bit  film essentially shot tiny room dull dialogue rather mundane cast  pal situation it hardcore a often shoot without reveal much  film look embarrassingly cheap absence thrill  although chill score   sound like something dark shadow  help little bit  many say pas   nurse beth seem nymphomaniac even screw nutty patient  always complain illness really it  enough chest hair declare neanderthal  it bad look  damson storyline  although frail  somewhat coherent   seem rarely direct film   overall  movie look like cost buck damson overcome budgetary restriction    opinion  create unpleasant enough atmosphere due sometimes plod narrative tedious scene little story   john f off role hospital psychiatrist want commit sherry  believe idea possess  constantly bicker peter  watch unrated  lose  version guess real version watch nurse sherry,negative
warehouse horror try use unconventional aesthetic cover fact another serial killer chiller ultimately rely pornographic combination teen quality violent gore  suburbs come across well every piece australia write  book film  since  surprise surprise  suburbs dark underbelly  plot contrive see   neighbor would never know guy   one filmmaker say joey character   completely plausible  serial killer it patch eye scar cheek  look like guy next door   another trader pornographic violence see serial killer every street  real insignificance film fact genre film nobody see  back substantial fund  include film finance  government   get run underground film festival rely ami kindness   short release season  q  of fund genre flick  even arty  aesthetically unconventional  q  nasty movie  acolyte  beautiful  punishment  road  make first place  richer  to encourage creator believe give mass really want  opposed culture elite government fund think want  truth brutal forgettable nastiest earn far critical acclaim  win far obscure award  due,negative
completely bore film  melodramatic apparent reason  every thing become serious people swear really dumb expression  serial killer apparently kill one person get title serial killer  well serial killer like butterfly illustrate sound effect might hear dream sequence modern film   be    be   oh  nave idea  really really want scary  think universe scary equal talk whole bunch add dark ambient record  way horror film  definitely thriller  barely   really movie maker nowadays need homework make  horror  film little call movie  horror  film  make say  may word ironically   acolyte  take forever say nothing,negative
rather lame teen slasher brisance  plot hinge fairly decent idea  write profoundly lame two three main teen absurdly wooden  problem kid go plan far reckless show   would perhaps hard likable  end neither really  fact  start enjoy film start wish death  one movie thousand place sensible option would call police  realize would it movie  would nice could believe actually would it  avoid,negative
decent movie first half  many cheap boo  moment tension build  bad guy creepy everything seem set nicely  kid particularly deep hey  work teen   be    be   get ridiculous try way hard  world would they   moment overwhelm anyone capacity suspension disbelief  twist involve many ridiculous coincidence  title come late attempt philosophize meaning film go nowhere quickly drop  laughter theater moment way suppose funny   be    be   great premise badly write it hold together  nice shot hard enjoy roll eye,negative
acolyte present interest mix original concept  scream teen  cliché horror pace  way acolytes successful  many way film fail miserably  be    be   overall acolyte avoid typical archetype naivety innocence youth endless horror film like cabin fever  texts chainsaw massacre  countless film unsuspecting relatively naive innocent teenager   run around scream pluck sort monster  instead innocence replace pride  retaliation  arrogance  character several opportunity save immanent death despair  fail due personal demon  end leave feeling  perhaps  innocent victim  be    be   name implies  film also touch greatly follow leader authority  use direct sense main character would become like serial killer also use little directly throughout film  follow central figure reoccurring theme throughout film  be    be    film maker also incorporate lot cliché  suspect intentional give film unique mixture depth well shallowness find intriguing   perhaps inadvertently  play well character  first appearance shallow story unfold become obvious  little two main male character  quite complex  be    be   technically film lot problem however  cinematography  typically regard highly  find rather sophomoric  utilize formulaic  approach far rigidly  many transition felt also  use symbolism vague  also greatly use  be    be   plot poorly plan rely exclusively misinformation order achieve rather hokey twist end  poorly resolve leaf viewer confuse  method use resolve climax cheap  motivation routinely unclear  major plot point remain untied end  be    be   overall  film relative originality  theme thesis lose maze poor technical execution  imagery  unclear motif  obtuse unnecessary symbolism cheap twist maintain lack entirely incorrect information  be    be   film well execute  would excellent  however  acolyte receives two star opinion,negative
